<?xml version="1.0" encoding="UTF-8"?>
<!-- edited with XMLSpy v2025 rel. 2 (x64) (https://www.altova.com) by Rohith (abc) -->
<xs:schema xmlns:xs="http://www.w3.org/2001/XMLSchema">
	<xs:element name="library">
		<xs:complexType>
			<xs:sequence>
				<xs:element name="book" maxOccurs="unbounded" minOccurs="1">
					<xs:complexType>
						<xs:sequence>
							<xs:element name="title" type="xs:string"/>
							<xs:element name="author" type="xs:string"/>
							<xs:element name="isbn" type="xs:string"/>
							<xs:element name="publisher" type="xs:string"/>
							<xs:element name="edition" type="xs:string"/>
							<xs:element name="price" type="xs:decimal"/>
						</xs:sequence>
					</xs:complexType>
				</xs:element>
			</xs:sequence>
		</xs:complexType>
	</xs:element>
</xs:schema>